商品ID,タイトル,紹介文,レーベル名,メーカー名,カテゴリ,価格,レーベル種別,出演者,公開開始日,商品URL
fellatiohunter-0148,個撮）全て吸い尽くす！ねっとりバキュームフェラ,"素朴でなんだかスケベオーラが滲み出ております。華奢だけど綺麗で可愛らしいおっぱいです。プルンと弾けて柔らかい萌えおっぱい。大きな舌をネットリ絡みつけ！間違いなくエロい！高鳴ります。カッポリとチンポを咥えこんで、まったりとバキューム！チンポを味わいながら、そのまま丸呑み！ねっとりからの高速ピストンに我慢限界！大量口内発射！口内発射→ごっくん→お掃除フェラのフルコースです！予想を裏切るムッツリスケベです。顔が歪むほどのバキューム！エロいひょっとこ顔は必見です。",フェラチオハンター,フェラチオハンター,フェチ,500,PPV,,2024年03月31日,http://duga.jp/ppv/fellatiohunter-0148/
fellatiohunter-0149,個撮）【低身長】守ってあげたいキュートな彼女,ヨシヨシしたくなる可愛い彼女。柔らかいカラダとプリッとしたお尻貧乳コンプレックス！萌えまくりです。勃起した乳首。感度は良好です。じっと見つめて長いベロ！可愛くてエロい乳首舐めです！可愛いひょっとこ顔で亀頭集中バキュームピストン。気持ち良すぎです。ひねりを加えたピストンフェラ、横顔も美しくエロい加速するフェラに我慢限界！そのまま大量口内発射！しっかりお掃除フェラまでしてくれます。とにかく萌えまくりの可愛さです。じっと見つめてフェラする姿に胸が高鳴りまくりでした！長くてエロい舌にも注目です。,フェラチオハンター,フェラチオハンター,フェチ,500,PPV,,2024年04月07日,http://duga.jp/ppv/fellatiohunter-0149/
fellatiohunter-0150,個撮）【おねだり顔射17】ちっちゃなお顔でチンポ丸呑み,生意気なのに超可愛い！意外とムッチリなお尻がそそります。可愛らしいAカップチッパイ。じっくり撮られて恥ずかしいでしょ？チッパイだって柔らかい。感度良好の乳首に萌えます。舌をチロチロ細かく動かして、スケベなテクニック持ってます。じっと見つめて絶妙なバキュームピストン！気持ち良すぎです。ちっちゃなお顔で余裕のチンポ丸呑み！なめらかなピストンがたまりません加速するフェラに我慢限界！大量ザーメンぶっかけ！可愛いお顔に濃厚ザーメンがべっとり！至福の時間です。生意気なのに本当にフェラが上手くて可愛くて、また会ってしまいました。彼女のフェラテクは間違いなくエロいです！,フェラチオハンター,フェラチオハンター,フェチ,500,PPV,,2024年04月14日,http://duga.jp/ppv/fellatiohunter-0150/
fellatiohunter-0151,個撮）【高身長】上品な美人お姉さん【口内発射】,"モデル級！スタイル抜群のお姉さん。しっとりとした雰囲気がそそります。ピンク乳首の美乳おっぱい。キメの細かい肌、柔らかいおっぱい。素敵です。大きい舌で乳首愛撫。器用に舌を動かします。バキュームフェラ顔のエロいこと！ねっとりとしたテクニックが気持ち良すぎです。相手の反応を伺いながらバキュームピストン。おしとやかな雰囲気とのギャップに萌えます。口内でチンポを転がしながら、見つめてピストン。我慢できずにそのまま口内発射！お掃除フェラもしてくれました。おしとやかで上品なお姉さんのネットリスケベなフェラチオが堪能できます。バキュームフェラ顔で見つめる表情がエロ過ぎました！",フェラチオハンター,フェラチオハンター,フェチ,500,PPV,,2024年04月21日,http://duga.jp/ppv/fellatiohunter-0151/
fellatiohunter-0152,個撮）むっちりデカ尻お嬢様【口内発射】,"上品な雰囲気がそそるお嬢様。むっちりデカ尻がなんともエロいです。美しいボディラインと、柔らかい美乳。じっくりと楽しみます。可愛いお顔でチロチロ乳首舐め！じっと見つめてこちらの反応を伺います。絶妙なバキュームとリズミカルなピストン。フェラ技も申し分なしです。顔を歪むほどの吸い付き＆はみがきフェラ加速するピストンに限界！そのまま口内発射！お掃除フェラもしてくれました。綺麗なお顔からは想像できないエロ過ぎるバキュームフェラ顔！上品な雰囲気とのギャップに大興奮でした。",フェラチオハンター,フェラチオハンター,フェチ,500,PPV,,2024年04月28日,http://duga.jp/ppv/fellatiohunter-0152/
fellatiohunter-0153,個撮）キャリア系デカ尻お姉さん【Gカップ美巨乳】,仕事できそうなキャリア系お姉さん。ムッチリしたカラダとデカ尻がそそります。美しいGカップ巨乳！キメの細かい色白の肌です！じっと見つめて乳首舐め。舐め顔がとても可愛らしいです。ジュッポリ！吸い付き顔がエロい！絶妙なピストンテクニックです。深めに呑みこむピストンフェラ。リズミカルに一所懸命フェラしてくれます。加速するピストンの我慢限界！彼女のテクニックを楽しみながら横アングルで大量口内発射！最後はお掃除フェラまでしてくれます。クールな雰囲気のお姉さんですが、フェラチオはとても献身的で萌えます。リズミカルなピストン、吸い付き顔がエロかったです。,フェラチオハンター,フェラチオハンター,フェチ,500,PPV,,2024年05月05日,http://duga.jp/ppv/fellatiohunter-0153/
fellatiohunter-0154,個撮）バキュームフェラ顔のギャップがエロい！,おっとり優しい雰囲気のお姉さん。とても美人でムッチリボディがたまりません！色白で本当に柔らかいおっぱい！思う存分楽しみます！微笑む姿がエロ過ぎる乳首舐め。長い舌が絡みつきます。ひねりを加えたバキュームピストン！気持ち良すぎです！口内で舌を絡めながらねっとり吸引！多様なフェラ技が凄いです。幸せ過ぎる柔乳パイズリ！じっと見つめてこちらの反応を伺ってます加速するバキュームピストンに我慢限界！そのまま口内発射！綺麗なお姉さんの贅沢奉仕。パイズリとフェラのコンボ技は本当に気持ち良かったです。,フェラチオハンター,フェラチオハンター,フェチ,500,PPV,,2024年05月12日,http://duga.jp/ppv/fellatiohunter-0154/
fellatiohunter-0155,個撮）黒髪キュートな彼女【敏感華奢ボディ】,黒髪で華奢なキュートな彼女。それでもおっぱいとお尻の程よい肉付きが柔らかい。可愛いサイズの綺麗なおっぱい！思う存分楽しみます！じっと見つめて舐める乳首。吸い込まれそうな瞳です。バキューム加減が絶妙なフェラ技。口内で舌が絡みついて気持ち良すぎです従順なピストンフェラに萌えます。イクまで止まない！加速するピストンに我慢限界！そのまま口内発射！黒髪で華奢なカラダに萌えまくり！絶妙なバキューム加減が気持ち良すぎです。チンポを咥えるバキューム顔のギャップに興奮しました。,フェラチオハンター,フェラチオハンター,フェチ,500,PPV,,2024年05月19日,http://duga.jp/ppv/fellatiohunter-0155/
fellatiohunter-0156,OLお姉さん濃厚唾液が絡みつくローリングピストンフェラ,"雰囲気からもうエロいです。スケベなお姉さんのカラダじっくり堪能します。ふんわり柔らかいおっぱいは触りごこち抜群！陥没乳首も可愛らしくてエロいです舌先使って乳首をチロチロしたり、チューと吸いあげたり、気持ち良すぎです！超ねっとりなローリングピストン！バキュームフェラ顔もスケベです。口内密着バキューム！口内の温もり、ネバネバがダイレクトに伝わりますじっと見つめてノーハンドピストン！我慢できず大量口内発射！エロさ抜群のお姉さん！濃厚な唾液が絡みつく、超ねっとりなフェラ技は気持ち良すぎでした。",フェラチオハンター,フェラチオハンター,フェチ,500,PPV,,2024年05月26日,http://duga.jp/ppv/fellatiohunter-0156/
fellatiohunter-0157,個撮）ねっとりバキューム＆唾液たっぷりはみがきフェラ,"ショートカットが似合う美人お姉さん。色白で柔らかいカラダを楽しみます。柔らかいおっぱい！大きめの乳首がそそります。じっと見つめて乳首をチロチロ、見つめる表情にゾクゾクします。絶妙なバキュームと濃厚唾液を絡ませたはみがきフェラが気持ち良すぎです。いろんな角度でキツツキフェラ！口内の粘膜にあたるのがよくわかります。加速するピストンに我慢限界！唾液でヌルヌルになったチンポをしごかれてそのまま大量発射！ショートカットが似合う美人お姉さん。顔を歪ませたピストンはみがきフェラ！濃厚な唾液が絡んで気持ち良すぎでした。綺麗なお姉さんの贅沢奉仕。パイズリとフェラのコンボ技は本当に気持ち良かったです。",フェラチオハンター,フェラチオハンター,フェチ,500,PPV,,2024年06月02日,http://duga.jp/ppv/fellatiohunter-0157/
fellatiohunter-0158,個撮）亀頭ジュボジュボ！絶妙ローリングフェラ,"可愛い瞳に吸い込まれそうな癒し系ギャル。ムッチリしたカラダを楽しみます。大粒乳首のDカップおっぱい。ハリも柔らかさも申し分なし！よく動く舌で乳首をねっとり愛撫。うっとりした表情がたまりません。亀頭をジュボジュボ！ノーハンドでピストンフェラ！反応を伺いながらローリングピストン！ヨダレ垂らしてチンポ丸呑みはエロすぎです！加速するピストンに我慢限界！そのままお口にめがけて大量発射！癒し系のギャル！見つめる瞳が可愛すぎです！亀頭重点のピストンテクニックはとてもエロかったです！",フェラチオハンター,フェラチオハンター,フェチ,500,PPV,,2024年06月09日,http://duga.jp/ppv/fellatiohunter-0158/
fellatiohunter-0159,個撮）余裕のチンポ丸呑み！エロ過ぎノーハンドフェラ,色白スレンダー美人のお姉さん。高身長でスタイル抜群です！小ぶりなのに凄く柔らかい！ピンク色の乳首がそそります。幅広の大きな舌がそそります。べろべろの乳首を舐め回して気持ち良すぎです！口いっぱいにチンポを丸呑み！ひねりを加えたバキュームフェラがエロいです。キツツキフェラからのチンポ丸呑み！高速ノーハンドフェラに我慢限界！そのままお口にめがけて大量発射！上品なのに凄いフェラ技！見た目とのギャップに興奮しました。高速ピストンからの丸呑みフェラは必見です！,フェラチオハンター,フェラチオハンター,フェチ,500,PPV,,2024年06月16日,http://duga.jp/ppv/fellatiohunter-0159/
fellatiohunter-0160,個撮）ショートカット金髪ギャル【Gカップ巨乳】,"ど派手な金髪ギャルです！ショートカットも似合っています。服の上からでもわかる巨乳に期待が高まります。ハリのあるGカップおっぱいを思う存分揉んじゃいます。チロチロと舌先を使った乳首舐め！気持ち良すぎます！序盤はまったりと亀頭を包み込むように優しくフェラチオ根元までチンポ丸呑み！横アングルでフェラ技を堪能してください！イクまで止めない！高速ノーハンドピストンに我慢限界！大量口内発射！普段ギャルとは無縁なのでどんなフェラをするのか興味深々！ムッチリとしたカラダもエロかったです。迫力の高速ノーハンドピストンは我慢なんて絶対できません！すごいフェラ技でした。",フェラチオハンター,フェラチオハンター,フェチ,500,PPV,,2024年06月23日,http://duga.jp/ppv/fellatiohunter-0160/
fellatiohunter-0161,個撮）ツインテールが可愛いすぎ！【Aカップ微乳萌え】,"ツインテールがよく似合う！スレンダーでスタイル抜群です。Aカップチッパイに萌え！おっぱいの感度良好です！なんて嬉しそうに舐めるんだ！見た目とのギャップで大興奮。チンポをじっくり味わいながらねっとりフェラチオ。表情がエロいです亀頭ピストンからローリングピストン！フェラ好きが伺えます。高速ノーハンドフェラに我慢限界！そのままお口にめがけて大量発射！とっても美人で萌えな彼女ですが、フェラする様子はとってもスケベ！見た目では想像できないドスケベちじょでした。",フェラチオハンター,フェラチオハンター,フェチ,500,PPV,,2024年06月30日,http://duga.jp/ppv/fellatiohunter-0161/
fellatiohunter-0162,個撮）【おねだり顔射18】可愛い顔してGカップボディ！,端正な顔立ちの彼女。服の上からでもわかるムッチリボディに大興奮迫力のGカップおっぱい！思う存分楽しみます。切れ長の瞳で見つめながら乳首をチロチロ舐め。気持ち良すぎです！小刻みなピストンからねっとりディープピストン！絶妙なバキュームで深めのピストンフェラ。あぁ気持ちいい！高速ピストンフェラで我慢限界！綺麗なお顔に大量顔射！発射の勢いに驚いたのか？くらったザーメンでカラダがよろけてます（笑）端正なお顔からは想像もできないスケベなフェラ技！そんな彼女に大量顔射できて本当に幸せでした。,フェラチオハンター,フェラチオハンター,フェチ,500,PPV,,2024年07月07日,http://duga.jp/ppv/fellatiohunter-0162/
fellatiohunter-0163,個撮）キュートなOLさん萌え！【口内発射】,"キュートな雰囲気が萌えるOLさん。むっちりデカ尻は揉みごたえ十分です。小ぶりでも柔らかく張りのあるおっぱい。感度も良好ですツンっと勃起した大粒乳首がそそります。可愛い瞳でじっと見つめて乳首舐め！反対の乳首は指で優しく愛撫。たまりません。たっぷりの唾液が絡むねっとりフェラ！絶妙なバキューム加減も良いです高速ピストンからの丸呑み！キュートな見た目とのギャップがスゴイ。高速ピストンフェラで我慢限界！大量口内発射！キュートな見た目から想像できないねっとりフェラ技！笑顔が可愛くて萌えまくりでした。",フェラチオハンター,フェラチオハンター,フェチ,500,PPV,,2024年07月14日,http://duga.jp/ppv/fellatiohunter-0163/
fellatiohunter-0164,個撮）顔でヌけちゃう美人お姉さん【口内発射】,"顔だけで抜けちゃう美人お姉さん。色白で柔らかいカラダをじっくりと堪能します。キメの細かい肌！美しいおっぱい！ぷっくり乳輪に萌えまくり。チロチロ舌を動かし乳首舐め。舐め顔もとても美しいです。独特のローリング技が新鮮！口内全体にチンポが擦れて気持ち良すぎです。ひねりを加えたバキュームピストン！ひょっとこ顔も素敵です。見つめられながら高速ピストン！我慢も限界！大量口内発射！新感覚のフェラ技に感動！こんなに美人でフェラも上手い！たっぷり楽しませてもらいました。",フェラチオハンター,フェラチオハンター,フェチ,500,PPV,,2024年07月28日,http://duga.jp/ppv/fellatiohunter-0164/
fellatiohunter-0165,個撮）Gカップ美巨乳お姉さん【じっと見つめて】,色白の綺麗なお姉さん。むっちりしたカラダを触ると、自ら抱き着いてきてかなりスケベなお姉さんです。色白でピンク乳首のGカップ美巨乳！思う存分楽しみます。授乳のような吸い付きとチロチロ舐め。あぁ気持ちいい。じっと見つめたひょっとこフェラ顔がとてもエロいです！反応を伺いながら、ヨダレ垂らしてノーハンドピストン。勃起チンポが包みこまれて至福の時間です。エロい視線でじっと見つめてGカップパイズリ。我慢限界！大量パイズリ発射！色白でとにかく美しいおっぱい思う存分楽しみました。エロ視線のバキュームフェラ顔も見どころです。,フェラチオハンター,フェラチオハンター,フェチ,500,PPV,,2024年08月04日,http://duga.jp/ppv/fellatiohunter-0165/
fellatiohunter-0166,個撮）【おねだり顔射19】むっちりデカ尻お姉さん,くっきりお顔のお姉さん。ムッチリとしたデカ尻は揉みごたえ抜群です！陥没乳首を弄りながら、おっぱい揉みまくり！じっと見つめながら乳首をチロチロ舐め。時折見せる乳首吸い付きもたまりませんエロい！すっぽんフェラ顔！ノーハンドピストンフェラが気持ち良すぎです丸呑みローリングピストン！綺麗なお顔でフェラ技はエグイです気持ち良すぎるフェラ技に我慢限界！大量顔射！ぽってり唇がエロいお姉さん！ラフな服装にも萌えます。見た目では想像できないエグいフェラ技は必見です。,フェラチオハンター,フェラチオハンター,フェチ,500,PPV,,2024年08月11日,http://duga.jp/ppv/fellatiohunter-0166/
fellatiohunter-0167,キュートな彼女はダンサー【ローリング技がエロい！】,大きな瞳が印象的なキュートな彼女！ダンス仕込みのムッチリボディがそそります。大きめスケベ乳首のロケットおっぱい。触りごこちも抜群です！じっと見つめながら乳首をチロチロ。可愛いです！絶妙バキュームのノーハンドフェラ！可愛い顔してローリングテクがエロ過ぎます！加速するフェラに我慢限界！そのままお口に大量発射！大きな瞳がキュートな彼女！可愛いらしい見た目で絶妙なローリングフェラ技は必見です！,フェラチオハンター,フェラチオハンター,フェチ,500,PPV,,2024年09月01日,http://duga.jp/ppv/fellatiohunter-0167/
fellatiohunter-0168,個撮）本当に可愛い！フェラチオアイドル4,本当に可愛いです！ムッチリ柔らかいカラダを触りながら期待が高まります！可愛らしいAカップチッパイ。感度良好で萌えます。幅広で長い！デカベロがエロいです。チロチロとエロベロ乳首舐め。見つめるお顔にゾクゾクします。ねっとりバキュームフェラ！絶妙な吸引密着が気持ち良すぎです。密着ローリングからのピストンフェラ！バリエーションも豊富です！加速するピストンに我慢限界！そのまま大量口内発射！アイドル級に可愛い彼女！そんな彼女のフェラ技がとにかくエグい。しかもほぼノーハンドフェラで本当にエロかったです。,フェラチオハンター,フェラチオハンター,フェチ,500,PPV,,2024年09月08日,http://duga.jp/ppv/fellatiohunter-0168/
fellatiohunter-0169,個撮）色白キュートなお姉さん【Gカップ美巨乳】,色白キュートなお姉さん。見た目の割にグラマラスなカラダに興奮します。Gカップ美巨乳のサプライズ！張りも柔らかさも極上です乳首を丁寧にチロチロ舐め。可愛らしい舐め顔です絶妙なバキューム加減のフェラ！ひょっとこ顔も萌えですジュボジュボノーハンドフェラ！極上の口マンコですねっとりピストンから加速するピストン！そのままお口に大量発射！横アングルフィニッシュですとにかく色白エロボディ！見た目とのギャップがそそります。ジュボジュボピストン技が極上のマンコのようでした。,フェラチオハンター,フェラチオハンター,フェチ,500,PPV,,2024年09月15日,http://duga.jp/ppv/fellatiohunter-0169/
fellatiohunter-0170,個撮）むっちり癒し系お姉さん【Gカップ柔乳】,むっちり癒し系のお姉さん。柔らかいカラダにムラムラします。色白のGカップ巨乳！幸せの揉み心地で最高です。乳首を舐め回したり、チロチロさせたり。スケベなテクニック持ってます。チンポに吸い付くフェラ顔がエロ過ぎる！絶妙なローリング技も素晴らしい！加速するフェラに我慢限界！そのまま大量口内発射！癒し系のお姉さん。チンポを咥えると雰囲気一変！実はチンポ大好きスケベお姉さんでした！絶妙なローリングフェラ技は必見です！,フェラチオハンター,フェラチオハンター,フェチ,500,PPV,,2024年09月29日,http://duga.jp/ppv/fellatiohunter-0170/
fellatiohunter-0171,個撮）美しすぎる人妻です！【最高クラスフェラ顔】,驚きの美人妻の登場です！色白でムッチリとしたカラダも最高です！Fカップ美乳！大きめのぷっくり乳輪がそそります。感度も良好です！じっと見つめて乳首舐め。あぁ綺麗だ！ねっとりと絡みつく舌技！エロいです。舌を絡めながら、ねっとりバキューム！気持ち良すぎです。綺麗なお顔でチンポ丸呑み！そんなことまでしてくれるんですか？最高です！加速するフェラに我慢限界！そのまま大量口内発射！最後の一滴までお掃除フェラで吸い取ってくれます。こんな綺麗な人がチンポをしゃぶってくれるなんて信じられません！フェラ顔もテクニックも最高クラスの美人妻でした！,フェラチオハンター,フェラチオハンター,フェチ,500,PPV,,2024年10月06日,http://duga.jp/ppv/fellatiohunter-0171/
fellatiohunter-0172,個撮）恥ずかしいくらいデカい【Hカップ爆乳お姉さん】,ニットセーター越しから物凄い膨らみ！胸の高鳴りが止まりません！迫力のHカップおっぱい！片手じゃ収まらない！柔らかすぎる揉み心地と至福の重み長い舌を使ってチロチロ！ベロンとねっとり舐め上げます。絶妙なバキュームが気持ち良すぎ！じっと見つめてノーハンドフェラ！相手の反応を伺いながらジュボジュボピストンフェラ！気持ち良すぎる！チンポ丸呑みパイズリ！エロすぎでもう我慢限界！そのまま爆乳パイズリ挟射！ニットセーター越しのおっぱいを触っている時からフル勃起！ただデカいだけじゃない！色も形も最高。そして顔も可愛いなんて反則です。,フェラチオハンター,フェラチオハンター,フェチ,500,PPV,,2024年10月13日,http://duga.jp/ppv/fellatiohunter-0172/
fellatiohunter-0173,個撮）Fカップ巨乳お姉さん【デカ舌＆デカ乳輪】,オリエンタルな雰囲気がエロい。笑顔が素敵なお姉さんです。ムッチリとしたカラダもそそります。柔らかい！Fカップおっぱい！ぷっくり膨らんだデカ乳輪がエロいです。大きな舌を使って乳首をベロンと舐め上げ！見つめる瞳に吸い込まれそうです。ジュボジュボと絶妙なバキュームのピストンフェラです。そそり立ったチンポ！ノーハンド直下ピストンが気持ち良すぎる！加速するピストンに我慢限界！そのまま大量発射！笑顔でごっくんまでしてくれます。最高です。オリエンタルな雰囲気と大きな瞳が印象的なお姉さん。大きな舌がねっとりと絡みついて最高に気持ちいいフェラでした。,フェラチオハンター,フェラチオハンター,フェチ,500,PPV,,2024年11月03日,http://duga.jp/ppv/fellatiohunter-0173/
