商品ID,タイトル,紹介文,レーベル名,メーカー名,カテゴリ,価格,レーベル種別,出演者,公開開始日,商品URL
fellatiohunter-0070,個撮）フェラ技を競う二人はエロ過ぎです,スタイル抜群！美巨乳の仲良し二人です。二人のおっぱい揉みくらべは幸せすぎます。相手のフェラを見るのは初めてみたいで二人とも興味津々。お互いフェラ好きなのを感じたのか、フェラ技を競うようにどんどん積極的になっていきます。我慢も限界！大量口内発射！もう一人の娘にはお掃除フェラをしてもらいます。本当にどちらもフェラチオがうまくてびっくりしました。,フェラチオハンター,フェラチオハンター,フェチ,500,PPV,,2022年09月04日,http://duga.jp/ppv/fellatiohunter-0070/
fellatiohunter-0071,個撮）お姉さんの強力バキューム＆ローリングフェラ,"迫力のおっぱいプリンッ！脱いだらホントに凄かった！思う存分揉みまくり！たっぷりの肉感を堪能します。幅広のエロい舌が絡みつきます。なかなか強力な吸引力！可愛くてエロいひょっとこバキューム顔！ねっとりとローリングピストン！気持ち良すぎです。じっと見つめて加速するピストン我慢限界！大量口内発射！",フェラチオハンター,フェラチオハンター,フェチ,500,PPV,,2022年10月02日,http://duga.jp/ppv/fellatiohunter-0071/
fellatiohunter-0072,個撮）こんなに美しい人妻には出会えません！,綺麗でエロい人妻。なかなか出会えないハイレベルマダムおっぱいペロンで恥ずかしがり萌え。柔らかくて感度良好です。可愛らしいベロ！よく動くこと！綺麗な顔からのひょっとこピストンフェラ余裕のディープピストン！やっぱりマダムはエロい亀頭集中！加速するピストンフェラ我慢限界、口内発射！,フェラチオハンター,フェラチオハンター,フェチ,500,PPV,,2022年10月09日,http://duga.jp/ppv/fellatiohunter-0072/
fellatiohunter-0073,個撮）【おねだり顔射（3）】白人クォーター美女！,白人クォーター美人！顔小さい！透き通る白い肌にムラムラします。やっぱり乳首は綺麗なピンク色でした！感度も良くて最高です。長い舌がエロい！ハイスペックな彼女です。いやらしいベロがチンポに絡みついて気持ち良すぎ！横顔美人！バキュームピストンフェラ。歯磨きフェラ顔も可愛らしいです。加速する亀頭集中ピストンで我慢限界！,フェラチオハンター,フェラチオハンター,フェチ,500,PPV,,2022年10月16日,http://duga.jp/ppv/fellatiohunter-0073/
fellatiohunter-0074,個撮）大人の色気を感じるフェラチオ【口内発射】,とても上品で綺麗なお姉さんです。落ち着いた雰囲気が素敵です。おっぱいも感度良好そんな綺麗なお姉さんが！見てください！このデカ乳輪！目玉乳輪チクビ！本当にエロいです。デカ乳輪フェチなのでいろいろアングルで大興奮！じっと見つめてエロい舌使い大人の色気を感じるピストンフェラです。綺麗なお姉さんの美しいフェラ横顔とてもエロくて素敵です！激しくなるピストンで我慢限界！お口の中に大量ザーメン発射！精子苦手そうなリアクションですが、頑張って受け入れてくれました。,フェラチオハンター,フェラチオハンター,フェチ,500,PPV,,2022年10月23日,http://duga.jp/ppv/fellatiohunter-0074/
fellatiohunter-0075,個撮）エロお姉さんのカリ責めフェラ＆爆乳パイズリ,服の上からでもわかる爆乳！どうぞご覧ください！Hカップおっぱいを思う存分揉みまくり！凄い重みそして柔らかさ。チンポをまさぐりながら見つめて乳首舐め舐め！エロいです。こちらの反応を伺いながらピストンフェラ！様々なテクニックで気持ちよくしてくれます。やっぱりしてくれました爆乳パイズリ！チンポがおっぱいに全部埋もれてます。エロすぎるパイズリに我慢限界！そのまま彼女の顎まで発射！迫力おっぱいにザーメンべっとりです。,フェラチオハンター,フェラチオハンター,フェチ,500,PPV,,2022年10月30日,http://duga.jp/ppv/fellatiohunter-0075/
fellatiohunter-0076,個撮）【おねだり顔射（4）】キャリア系美人お姉さん！,キャリア系のクールな美人お姉さん。色白ムッチリ！おっぱいも凄い綺麗です。エロスイッチが入った舐め顔がとってもスケベです。じっと見つめてねっとりとバキュームピストンフェラよだれ垂らして加速する亀頭集中ピストンフェラ美しいお顔に濃厚ザーメンをぶっかける快感！ザーメン顔にチンポを差し出しお掃除フェラ。,フェラチオハンター,フェラチオハンター,フェチ,500,PPV,,2022年11月06日,http://duga.jp/ppv/fellatiohunter-0076/
fellatiohunter-0077,個撮）ディープスロート＆高速カリ責めピストンフェラ,こんな保母さんがいたらいいな。とても優しい雰囲気の癒し系お姉さんです。最初は緊張気味の様子。脱いだらスゴイ！迫力のおっぱい！ずっしりと重たく揉みごたえ充分！舐め顔可愛い！じっと見つめたバキュームフェラ顔に興奮じーっくり、ねーっとりとディープスロート容赦ない高速カリ責めフェラで我慢限界！大量口内発射！ザーメン喉奥ヒットで顔がゆがませます。,フェラチオハンター,フェラチオハンター,フェチ,500,PPV,,2022年11月13日,http://duga.jp/ppv/fellatiohunter-0077/
fellatiohunter-0078,個撮）美人妻の浮気フェラ（1）,昼下がりに美人妻と会いました。エロい雰囲気が室内に漂います。半熟れ乳首は感度良好。しっとりとした肌がとても気持ちがいい彼女です。いやらしい視線で舐めてきます。いろんな角度から口内侵入！頬の粘膜にチンポが擦れて気持ちがいいです反応を伺いながら高速カリ責めピストン！気持ち良すぎて我慢限界！大量口内発射！,フェラチオハンター,フェラチオハンター,フェチ,500,PPV,,2022年11月20日,http://duga.jp/ppv/fellatiohunter-0078/
fellatiohunter-0079,個撮）ディープピストン＆ローリングフェラ【口内発射】,"色白で可愛らしい彼女。脱いだらびっくり！Fカップ美乳でした！綺麗な乳首と柔らかいおっぱいフレームアウトしちゃうぐらい大きい舌！エロいです。笑顔で見つめながらエロ舌が絡みつきます。想定外のフェラ技！深くローリングするピストン！本当に気持ちがいいです！深ーい！チンポの付け根まで丸呑みです！なんでそんなに上手いんだ？フェラチオの才能が凄すぎです。我慢限界！大量口内発射！",フェラチオハンター,フェラチオハンター,フェチ,500,PPV,,2022年11月27日,http://duga.jp/ppv/fellatiohunter-0079/
fellatiohunter-0080,個撮）イクまで止めない！ノーハンドフェラ【口内発射】,色気たっぷりな綺麗なお姉さん。意外なチッパイがとても敏感です。大きな瞳で何度も見つめて、こちらの反応を伺います。綺麗なお顔を歪ませたひょっとこフェラ顔がエロいです。バキューム加えた亀頭集中キツツキフェラ！イクまで止めない！ノーハンドピストンフェラ！我慢ができずに大量発射！最後はしっかりお掃除してくれます。,フェラチオハンター,フェラチオハンター,フェチ,500,PPV,,2022年12月04日,http://duga.jp/ppv/fellatiohunter-0080/
fellatiohunter-0081,個撮）よだれダラダラ濃厚フェラチオ【口内発射】,誰もが認める美人お姉さん。服の上からでも敏感に反応。Fカップおっぱいは揉みごたえたっぷり！見つめる瞳に思わずどっきり！美しいエロお姉さんです。リズミカルなピストンがエロいです！深ーい！！チンポ丸飲みです。頬をすぼめた横フェラ顔！素敵すぎ！よだれダラダラフェラ！加速するピストン我慢ができず大量口内発射美人のお姉さんがこんなエゲツないフェラをするなんて！痴女感たっぷりのエロいフェラチオでした。,フェラチオハンター,フェラチオハンター,フェチ,500,PPV,,2022年12月11日,http://duga.jp/ppv/fellatiohunter-0081/
fellatiohunter-0082,個撮）【おねだり顔射（5）】ゆるふわ系女子！,ゆるふわ女子に出会えるのって珍しいです！はじめる前から大興奮！おっぱいもお尻もフワフワで気持ちがいいです。じっと見つめて乳首舐め！とにかく可愛い！エロ可愛いひょっとこバキューム！ネジレをきかせた深ーいピストン！根元まで丸呑みです。我慢限界！ナチュラルな優しいお顔に大量顔射！たっぷり濃厚ザーメンを全部お顔で受け止めてくれました。ナチュラルなゆるふわ系女子！めちゃ可愛いです！そして想像以上のフェラテクで驚きました！ぶっかけられた濃厚ザーメン顔も必見です。,フェラチオハンター,フェラチオハンター,フェチ,500,PPV,,2022年12月18日,http://duga.jp/ppv/fellatiohunter-0082/
fellatiohunter-0083,個撮）大きな瞳で見つめてフェラチオ【口内発射】,"ガーリー系の可愛い女の子です。脱いだら形の良いEカップおっぱいでした。張りのある揉み心地！歯の矯正！若いですね！見つめてベローっと乳首舐め！可愛いです。ガーリーな女の子だってフェラチオはこんなにエロいんです！根元までズッポリ！余裕のピストン！加速するピストンに我慢限界！大量口内発射！大きな瞳がとても素敵なガーリー系女子！ファッションも可愛らしいです。いわゆる地雷系かと身構えましたがフェラチオ大好き！嬉しそうにフェラしてくれました。",フェラチオハンター,フェラチオハンター,フェチ,500,PPV,,2022年12月25日,http://duga.jp/ppv/fellatiohunter-0083/
fellatiohunter-0084,個撮）チンポ丸呑みストロークフェラ【口内発射】,"綺麗なお姉さんです！感度良好なEカップおっぱいはとっても柔らか。乳首をチューチューと吸って、ぺろぺろと亀頭を舐めたりチンポが全部なくなっちゃう！丸呑みピストンが気持ち良すぎです！まったり深いピストンが彼女のベーステクニック！ねっとりバキューム！ひょっとこフェラ顔がエロかわいい！高速ノーハンドピストンで我慢限界！そのまま大量口内発射！しっかりお掃除フェラもしてくれました満足げな表情。素敵です。綺麗なお姉さんのお口に全部チンポが入っちゃって。それだけでも幸せなのに最後は高速ノーハンドピストン！深いスロートが本当にエロい女性でした。",フェラチオハンター,フェラチオハンター,フェチ,500,PPV,,2023年01月01日,http://duga.jp/ppv/fellatiohunter-0084/
fellatiohunter-0085,個撮）経験少ない可愛いフェラチオ＆爆乳大量発射！,"ゆったりニットでわからなかったですが、脱いでみたら驚きの爆乳でした！揉みごたえ十分！本当に抜けるカラダです。とても不安そうですが、頑張って舐めてくれています。こちらの反応を伺いながら一生懸命フェラしてくれます。ウブですほんと。可愛い顔して乳首舐め手コキ！気持ち良すぎです。我慢限界！そのままおっぱいに大量発射！Hカップ爆乳に大量ザーメン！エロ過ぎです可愛らしい顔してとにかく凄いカラダ！そのギャップにとにかく興奮しました！一生懸命にフェラする姿もとっても素敵でした。",フェラチオハンター,フェラチオハンター,フェチ,500,PPV,,2023年01月08日,http://duga.jp/ppv/fellatiohunter-0085/
fellatiohunter-0086,"個撮） チンポをむさぼる変態的フェラチオ【口内発射】","服の上から触っても感度良好！敏感体質の女の子期待大です陥没気味の乳首もいじればすぐに勃起しちゃいます。可愛さと美しさ、そしてちょっと生意気な表情。魅力的な女の子です舐め顔がとってもエロい！スイッチ入ってきました！チンポを丸呑みしないと気が済まない！悦な表情からM気が伺えます。終わらない丸呑みピストンチンポをむさぼる姿は変態的！我慢限界！大量口内発射！苦しそう。でも嬉しそう。綺麗なのに可愛らしい。とっても魅力的な女の子でした。チンポを咥えるなり雰囲気が一変！かなりM気質なフェラチオでした。",フェラチオハンター,フェラチオハンター,フェチ,500,PPV,,2023年01月15日,http://duga.jp/ppv/fellatiohunter-0086/
fellatiohunter-0087,個撮）見つめてバキュームピストン＆ノーハンドフェラ,パッチリ瞳の色白女の子。期待が高まります。キメの細かい色白の肌が美しいです。柔らかいおっぱい、ムッチリとした下半身がそそります。舐めながらじっと見つめる瞳が可愛らしい。ノーハンドバキュームピストン！気持ち良すぎです反応を伺いながらフェラする姿がエロいです。加速するピストンに我慢も限界！彼女の舌上にザーメン発射！色白な美人お姉さん。ノーハンドのバキュームフェラ顔や、こちらの反応を伺いながらフェラする姿がなんともエロかったです。,フェラチオハンター,フェラチオハンター,フェチ,500,PPV,,2023年01月22日,http://duga.jp/ppv/fellatiohunter-0087/
fellatiohunter-0088,"個撮） 【おねだり顔射（6）】キュートな彼女",これは間違いなく可愛い！華奢なカラダに程よいおっぱいの膨らみ。感度の良い乳首が可愛いです。じっと見つめたベロ舐めがたまりません。可愛い顔して凄いフェラテク！余裕の丸呑み！ノーハンドピストンがエロ過ぎです！横アングルでストロークの深さが伺えます。まったり＆高速を織り交ぜるピストンテクニックは必見！加速するピストンに我慢限界！大量場外顔射！！キュートなお顔にたっぷりザーメンかけちゃいました。可愛い顔して凄いフェラチオテクニック！丸呑みノーハンドピストンは必見です！性格も本当によくて彼女に萌えまくり。いつもよりザーメンの量が多い気がします。,フェラチオハンター,フェラチオハンター,フェチ,500,PPV,,2023年01月29日,http://duga.jp/ppv/fellatiohunter-0088/
fellatiohunter-0089,個撮）ヨダレ垂らしてチンポ丸呑み！【エロいお姉さん】,全身からエロい雰囲気が漂う奥さん。期待が高まります。感度良好なスレンダーボディです。大きな乳首がエロいです。すごく柔らかいおっぱい！触っているだけで幸せです。大きな舌が気持ち良すぎ！ねっとりとバキュームフェラ！じっと見つめる口マンコは最高です。横アングルからのノーハンドフェラ。ヨダレ垂らして余裕の丸呑み！加速するピストンに我慢限界！大量発射！わかりやすい！絶対エロいお姉さんです！雰囲気もしゃべり方もエロく、近くにいるだけでチンポが反応してしまいます。まったりピストンからの高速ピストン。フェラテクも間違いないです！,フェラチオハンター,フェラチオハンター,フェチ,500,PPV,,2023年02月05日,http://duga.jp/ppv/fellatiohunter-0089/
fellatiohunter-0090,個撮）美人でキュート！【ムッチリFカップ美巨乳】,マスクをしていてもわかる美人のオーラ！まん丸な美巨乳！柔らかい肉感！幸せです。エロい下着とボリューミーな尻！スケベな視線で、ほほ笑み浮かべたベロ舐め緩急つけたノーハンドバキュームピストン！反応を伺いながら上目遣い。興奮しないわけない！我慢限界！大量口内発射！口内ザーメン直撃のリアクションも必見です！美人なのにとてもキュートなお姉さん。ムッチリなカラダも素晴らしいです。上目遣いで反応を伺うフェラチオはエロすぎます！,フェラチオハンター,フェラチオハンター,フェチ,500,PPV,,2023年02月12日,http://duga.jp/ppv/fellatiohunter-0090/
fellatiohunter-0091,"個撮）フェラの才能が凄すぎる！【Fカップ神巨乳降臨】",若い女の子のピチピチで色白な肌！なんて綺麗なおっぱいなんだ！ぷっくり膨らんだ乳輪、ピンク色の乳首がまぶしい！長い舌を巧みに動かした舐めテクニック！余裕の丸呑み！ジュボジュボと音を立ててローリングバキュームピストン！強烈なノーハンドピストンからの丸呑みチンポ！圧巻のフェラテクです我慢限界！大量口内発射！そしてごっくんサプライズ！まさに神乳降臨！素晴らしい美巨乳です。そしてそれ以上に驚いたのが圧巻のフェラチオテクニック！咥えた瞬間からもうヤバくて我慢するのに必死でした（汗）,フェラチオハンター,フェラチオハンター,フェチ,500,PPV,,2023年02月19日,http://duga.jp/ppv/fellatiohunter-0091/
fellatiohunter-0092,個撮）ほがらか美人は超敏感！【口内発射】,職場に一人いそうな普通感の女性に出会えるのって案外難しいですよ。そして敏感体質！胸が高鳴ります。嬉しそうに目をキラつかせて舐めまわし。じっと見つめてピストン時々ディープスロート横アングルでチンポを奥までねじ込む感が超エロいです！激しくなるピストンフェラで我慢限界！大量口内発射で歪む顔！お掃除フェラもありがたい。普通感の女性（とは言っても美人です）のフェラチオは普段とのギャップで興奮しちゃいます。しかもレベル高いフェラテク。世の中誰がエロくてフェラが上手いかなんてわからないものですね。,フェラチオハンター,フェラチオハンター,フェチ,500,PPV,,2023年02月26日,http://duga.jp/ppv/fellatiohunter-0092/
fellatiohunter-0093,個撮）萌えるフェラ技！【無印良娘】天然エロすぎ！,"恥ずかしい？緊張してる？それでもおっぱい触っていきます。予想外のスケベ乳首に大興奮！感度良好！イジりがいがあります。じっと見つめて乳首舐め。チンポを触り始めて結構その気になってます。ネットリ！じっくり！とても丁寧にフェラチオしてくれます。しっかり奥まで咥えてくれます。ヨダレたっぷりで気持ち良すぎです。ひねりを加えて亀頭集中！激しくなるピストンに我慢限界！たっぷり口内発射！無添加具合が萌える女の子です。意外に積極的なフェラ技に萌えまくり！エロいお姉さんにも負けないテクニック！フェラチオってボーダーレスですよね。",フェラチオハンター,フェラチオハンター,フェチ,500,PPV,,2023年03月05日,http://duga.jp/ppv/fellatiohunter-0093/
fellatiohunter-0094,個撮）優しいエロスなお姉さん【柔乳Fカップ】,服の上からでもわかるなんとも柔らかいおっぱいすばらしい弾力と柔らかさ！大きめの乳輪がエロいです。チューっと乳首を吸ったり、チロチロ舐めたりエロい舐め技持ってます。気持ち良すぎるローリングフェラ！本当にフェラチオが上手いです！柔らかいおっぱいがギンギンチンポを包みこむ。密着度が凄くて気持ち良すぎ！我慢限界大量パイズリ発射！ドピュッと精子が彼女のあごまで到達。優しい雰囲気のお姉さんですが、フェラ技はかなり積極的！Fカップの柔らかいおっぱいのパイズリは速攻やられてしまいました。,フェラチオハンター,フェラチオハンター,フェチ,500,PPV,,2023年03月12日,http://duga.jp/ppv/fellatiohunter-0094/
fellatiohunter-0095,個撮）【おねだり顔射（7）】癒し系ギャルのスゴ技,ど派手な金髪！なのになんだか癒し系のギャルです。敏感なおっぱいとボリューミーなお尻大きな瞳でじっと見つめて。舐め顔かわいいです！リズミカルな丸呑みピストン！ノーハンドで咥えてエロいです！ねっとりとディープスロート。横アングルでチンポを呑みこむフェラ顔が素敵！可愛いお顔に大量ぶっかけ！濃厚です！大きな瞳が可愛らしい彼女。フェラテクも素晴らしいです！そんな彼女の可愛いお顔に大量ぶっかけ！大満足でした。濃厚な一発をお楽しみください。,フェラチオハンター,フェラチオハンター,フェチ,500,PPV,,2023年03月19日,http://duga.jp/ppv/fellatiohunter-0095/
fellatiohunter-0096,個撮）現●早大生20歳【頭がいい子のしゃぶり方】,秀才オーラの彼女はどれほどエロいのか？気になります。キメの細かい色白な肌、形のいいおっぱいとお尻。上品なカラダです。可愛い顔してねっとり舐める！男のカラダを味わってます。サオ舐めからのパックンチョ！男のツボを心得ています。横アングルでノーハンドピストン！フェラのスキルが丸わかり！意外な展開！驚きの高速ピストンフェラに大興奮！そのまま大量口内発射！気のせいか、インテリジェンスを感じるフェラでした。しかし後半の高速フェラはまるでヘドバン！激しすぎ！内に秘めたエロがまだまだ彼女はありそうです。,フェラチオハンター,フェラチオハンター,フェチ,500,PPV,,2023年03月26日,http://duga.jp/ppv/fellatiohunter-0096/
fellatiohunter-0097,個撮）ド派手なケバエロお姉さん！【口内発射】,来ました！ド派手なお姉さんの登場です！エロいオーラが溢れまくりです。綺麗なおっぱいは感度良好！カラダをビクつかせて可愛らしいです。大きなエロ舌！この舌で舐められると思うとゾクゾクします。じっと見つめてて舌をチロチロそしてベロっとチンポ丸呑み！余裕のピストンテクニック！チンポを根元まで味わい尽くす！いやらしいお姉さんです。激しくなるピストンに我慢限界！大量口内発射！色気ムンムンのお姉さん。期待を裏切らないフェラチオテクニックはエロ過ぎます！と言いつつ、実はシャイで敏感で恥ずかしがり屋なところに萌えてました。,フェラチオハンター,フェラチオハンター,フェチ,500,PPV,,2023年04月02日,http://duga.jp/ppv/fellatiohunter-0097/
fellatiohunter-0098,個撮）淫靡な萌えッ子【根スケ全快！】【口内発射】,"根スケのオーラ全快で見つめる娘。服越しでもわかる意外に大きいおっぱい。そしてエロい下着予想以上に大きめのおっぱい。形も綺麗で、なんといってもこの柔らかさ。吸い込まれそうな瞳に見つめられながら、チロチロ乳首舐め＆亀頭舐め。ねっとりバキュームでチンポを包みこむテクニック！エロ過ぎ。深ーい！ストロークでチンポ丸呑み！大量のよだれがチンポに絡みつく！このフェラテクニック見てください↑↑↑エロいですよね〜！柔らかいおっぱい揉まれ、感じてるときのフェラ顔が可愛すぎる！そのまま大量口内発射！映像から伝わる根スケ感を是非感じてください。そしてかなり可愛い子です。またそして凄いフェラテクです！ヌケるフェラ動画だと思います。",フェラチオハンター,フェラチオハンター,フェチ,500,PPV,,2023年04月09日,http://duga.jp/ppv/fellatiohunter-0098/
