商品ID,タイトル,紹介文,レーベル名,メーカー名,カテゴリ,価格,レーベル種別,出演者,公開開始日,商品URL
fellatiohunter-0123,個撮）Gカップ美巨乳大●生【ひょっとこバキューム】,クラスに一人はいた大きなおっぱいの女の子。そんな親近感があって思わず抱きつきたくようなムッチリボディ恥ずかしながらもGカップのおっぱいを披露！迫力満点の美しいおっぱいです！重量感のある揉みごこち！思う存分楽しみます。メリハリのある舐め技！見つめる顔が可愛らしいです！絶妙なバキュームのピストン！気持ち良すぎです！こちらの反応を伺う上目遣いフェラがエロいです。容赦ない高速ピストンフェラで我慢限界！大量口内発射！最後はお掃除フェラまでしてくれました。ニット越しの突き出たおっぱいがエロ過ぎて、始まる前からドキドキが止みません。ハリのあるおっぱいを思う存分揉みまくれて幸せ過ぎでした。絶妙なバキュームのフェラや最後の高速ピストンはスゴイです。,フェラチオハンター,フェラチオハンター,フェチ,500,PPV,,2023年10月01日,http://duga.jp/ppv/fellatiohunter-0123/
fellatiohunter-0124,個撮）ゴシック系フェラ好き娘【Fカップ柔乳】,個人的にはあまり出会いのないゴシック系の女の子。どんなフェラチオをしてくれるのか？胸が高鳴ります。脱いだら意外と大きいFカップ美乳。色白の肌も美しいです。プリンっとした弾力！そして凄く柔らかいおっぱいです！ハニカミながら舐める姿に萌えまくり！唾液量の多い舌がチンポに絡む！絶妙なバキューム加減が気持ち良すぎです！加速するピストンに我慢限界！大量口内発射！最後はお掃除フェラまでしてくれました！ゴシック系の女の子ってエロいことに無関心なイメージがありましたが、全然そんなことはありません！唾液が多いフェラチオでチンポはネバネバ！最高に気持ち良かったです。,フェラチオハンター,フェラチオハンター,フェチ,500,PPV,,2023年10月08日,http://duga.jp/ppv/fellatiohunter-0124/
fellatiohunter-0125,個撮）恥ずかしいくらいデカい！【Jカップ爆乳妻】,服の上からまるわかりのデカさ！普段から集まるエロ視線。そりゃ恥ずかしいですよね。Jカップ爆乳のお披露目！重力には逆らえないドエロなタレ具合！最高です！迫力の重量感と柔らかさ！思う存分楽しみます！乳首を舐めながら、エロ視線で微笑む様子がたまりません。丸呑みパイズリとねっとりバキュームフェラ！快楽フルコースです！エロ過ぎる乳揺れフェラに限界！大量口内発射！お掃除フェラまでしっかりしてくれます。とにかくデカい！圧巻の重力と柔らかさ！チンポが見えなくなる丸呑みパイズリ＆絶妙なフェラ技！欲張りな快楽フルコースでした。,フェラチオハンター,フェラチオハンター,フェチ,500,PPV,,2023年10月15日,http://duga.jp/ppv/fellatiohunter-0125/
fellatiohunter-0126,個撮）【Gカップ美乳＆ぷっくり乳輪】【口内発射】,"目ヂカラ強めなお姉さん。おっぱいもお尻もムチムチです。迫力のGカップおっぱいです！張りのあるおっぱい！美しすぎます。なんとも柔らかく、たまらない重力感！思う存分揉みまくります。濃いめのぷっくり乳首がきゅっと勃起！正直な反応に大興奮です。乳首を舐め回すいやらしい表情！反対の乳首を手でイジる娘は絶対スケベなんです。このスケベなひょっとこ顔！ひねりを加えたバキュームピストン！気持ち良すぎです。唇がチンポに絡みつく！相手の反応を確認しながらフェラする姿は本当にエロいです。おっぱい触りながらフェラされて、加速するピストンに我慢限界！大量口内発射！最後はお掃除までしてもらいました。ムッチリといやらしいカラダのお姉さん。フェラする表情が本当にスケベで、ねっとりとした吸引＆ひねりを加えたピストン！チンポに絡みまくるフェラ技が本当に気持ち良かったです。",フェラチオハンター,フェラチオハンター,フェチ,500,PPV,,2023年10月22日,http://duga.jp/ppv/fellatiohunter-0126/
fellatiohunter-0127,個撮）ド派手な黒ギャル！【褐色Fカップ美乳】,ド派手な黒ギャルさんの登場です！褐色のむっちりボディがたまりません。Fカップおっぱい！乳首と肌の色が同化してるのもまた萌えるです。ぷるるん！とめっちゃ柔らかいです！ジッと見つめて乳首をチロチロ。ギャル顔好きにはたまりません。ひょっとこバキューム＆ローリングピストン余裕のチンポ丸呑み！喉奥にチンポがあたってキューっと締め付けてきます。ねーっとりと丸呑み！口内で舌を絡みつける物凄いテクニックです。ノーハンド高速ピストンに我慢限界！大量口内発射！褐色の肌がエロすぎる黒ギャルさん。丸呑みやらローリングやらフェラチオテクニックが凄すぎです。見た目で怖いと思いきやめっちゃ気さくで素敵な娘でした。,フェラチオハンター,フェラチオハンター,フェチ,500,PPV,,2023年10月29日,http://duga.jp/ppv/fellatiohunter-0127/
fellatiohunter-0128,個撮）フェラ顔のギャップが凄い！【Fカップ美乳】,色白の綺麗なお姉さんは好きですか？ムッチリと柔らかい触り心地がたまりません。なんて綺麗なおっぱい！色素の薄い大きめ乳輪がそそります。弾けるおっぱい！Fカップ美乳を思う存分楽しみます。大きくて長い舌が乳首にまとわりつきます。ゾクゾクと気持ちいい！美人のお顔でひょっとこバキューム！エロいです！ひねりを加えた吸引テクニック！気持ち良すぎです！おっぱい揉みながら至福のフェラチオタイム高速ノーハンドピストンフェラで我慢限界！大量口内発射！お掃除フェラもしっかり！色白ムッチリの綺麗なお姉さん。おしとやかな顔からは想像できない、エロ過ぎるひょっとこ顔！それだけで何度もヌケちゃいますよ！,フェラチオハンター,フェラチオハンター,フェチ,500,PPV,,2023年11月05日,http://duga.jp/ppv/fellatiohunter-0128/
fellatiohunter-0129,個撮）キュートな彼女のデカベロがエロい！【口内発射】,"可愛らしい彼女のムッチリとしたカラダを存分に楽しみます！恥ずかしそうに見せてくれたおっぱい。乳首がギュッと勃起しちゃってます。ちいさいお口から出てきた大きな舌！見てるだけでゾクゾクします。まさにベロ○ンチョ！見つめる笑顔がエロいです。ねっとりとローリングピストン。余裕の丸呑みです。ヨダレだらだら！ネバネバの口内にチンポがズッポリ入ります！デカベロを絡めたエロ過ぎるフェラチオテクニックです。高速ノーハンドピストンフェラで我慢限界！喉奥大量口内発射！発射直後の表情に萌えます。キュートな彼女に油断してました。まったりローリング＆余裕の丸呑み！ギャップの凄いフェラ技に萌えまくりでした。",フェラチオハンター,フェラチオハンター,フェチ,500,PPV,,2023年11月12日,http://duga.jp/ppv/fellatiohunter-0129/
fellatiohunter-0130,個撮）大量ヨダレがチンポに絡む【口内発射,"色白美人のお姉さん。カラダを触られて気まずい表情もそそります。肌のキメが細かい！Fカップ美乳！思う存分楽しみます。張りがあるのに柔らかプルプルおっぱいです。綺麗なお顔でいやらしい愛撫。エロ過ぎます。ねっとり味わいスローフェラ、口内の温もりが気持ちいい。大量ヨダレがチンポに絡みつく！ネバネバのピストンフェラです。根元までズッポリストローク！見つめるフェラ顔に大興奮！我慢ができずに大量口内発射！綺麗なお姉さんのネットリヨダレフェラ！じっと見つめる表情が本当に可愛いいです。ネバネバフェラからのズッポリフェラのコンボ技が最高に気持ち良かったです！",フェラチオハンター,フェラチオハンター,フェチ,500,PPV,,2023年11月19日,http://duga.jp/ppv/fellatiohunter-0130/
fellatiohunter-0131,個撮）深い！チンポ丸呑み美人妻【口内発射】,"色気ムンムンの美人妻です。感度良好なエロいカラダです。GIF12Fカップおっぱいの美しいバストライン！プルン！と弾ける張りのあるおっぱいです。ねっとりと柔らかい舌が絡みつく！見つめる表情がエロ過ぎます。余裕のチンポ丸呑みピストン！ローリングが加えた絶妙なフェラチオテクニック！唾液を絡ませて。程よいバキュームの刺激がたまりません。チンポを舌で包み込んで！エロ過ぎるフェラ顔です！加速するバキュームフェラに我慢限界！大量口内発射！綺麗な奥さんの余裕の丸呑みピストンがエロ過ぎでした！若い子にはない色気を堪能できると思います。",フェラチオハンター,フェラチオハンター,フェチ,500,PPV,,2023年11月26日,http://duga.jp/ppv/fellatiohunter-0131/
fellatiohunter-0132,個撮）生意気！ガーリー系女子と思いきや【口内発射】,可愛くて華奢なガーリー系女子。意外にボリューミーなお尻がそそります。チッパイでも感度良好！ツンっと勃起した乳首がよいです両方の乳首を同時愛撫。可愛い顔してエロい娘です。嬉しそうにチンポを丸呑み！可愛い顔とひょっとこフェラ顔のギャップがたまりません。こちらの反応を伺いながら絶妙バキュームのディープスロートじっと見つめて加速する！ノーハンドピストン！我慢も限界大量口内発射！生意気そうなガーリー系女子と思いきや、嬉しそうにチンポ丸呑み！可愛い顔とひょっとこ顔のギャップがエロかったです！,フェラチオハンター,フェラチオハンター,フェチ,500,PPV,,2023年12月03日,http://duga.jp/ppv/fellatiohunter-0132/
fellatiohunter-0133,個撮）本当に可愛い！フェラチオアイドル3,"トキメキが止まらない！めちゃくちゃ可愛い女の子です！バランスの取れた美しいカラダにも萌え！形のいいおっぱい！完全陥没乳首が恥ずかしいようでムラつきます。唾液たっぷりの舌がねっとりと絡みついて気持ち良すぎです。絶妙なバキュームフェラ！フェラ顔も本当に可愛いです。こちらの反応を伺いながら、ひねりを加えたピストン！予想外のフェラテクにタジタジ加速するピストンに我慢限界！大量口内発射！ハーフ系の本当に可愛いおんなの子！フェラ顔もフェラ技も間違いないです！ヌケる動画だと思います！是非！",フェラチオハンター,フェラチオハンター,フェチ,500,PPV,,2023年12月10日,http://duga.jp/ppv/fellatiohunter-0133/
fellatiohunter-0134,個撮）金髪ショートカットギャル【至福のパイズリ発射】,金髪ショートカットがよく似合うムッチリボディの女の子迫力のGカップおっぱいを披露！恥ずかしがる姿に萌えます。プルプルの柔らかさと重量感！長い舌をねっとり絡ませて、微笑む笑顔が素敵すぎ！絶妙なバキュームフェラ。おいしそうにチンポを咥えてくれます。ヨダレ垂らしておしゃぶり。絡みつく舌が気持ち良すぎです。フル勃起したチンポが柔らか巨乳にう包まれて。あぁなんて気持ちいいんだ！パイズリもこんなに上手で驚きです。我慢できずに大量パイズリ発射！フェラもパイズリも絶妙な上手さ！エロいです。アニメのような金髪ショートのキャラクターにも興奮しました！,フェラチオハンター,フェラチオハンター,フェチ,500,PPV,,2023年12月24日,http://duga.jp/ppv/fellatiohunter-0134/
fellatiohunter-0135,個撮）【おねだり顔射14】キュートな彼女,瞳が綺麗なキュートな彼女。ムッチリしたお尻もそそります。色白で形の良いおっぱい。ぷっくり乳輪も可愛らしいです。大きくてながーい舌！エロいです！エロ舌を感じながら乳首舐め。気持ち良すぎです。じっと見つめてピストンフェラ。至福の時間です。大きな舌にチンポが包まれて、絶妙なバキュームピストンです。大興奮しまくりの大量ザーメン発射！！可愛いお顔にザーメンべっとりです！とにかく可愛いです！大きくて長い舌がとてもエロくて大興奮！そんな彼女に大量ザーメンぶっかけ！大満足です。ヌケる動画だと思います！,フェラチオハンター,フェラチオハンター,フェチ,500,PPV,,2023年12月31日,http://duga.jp/ppv/fellatiohunter-0135/
fellatiohunter-0136,個撮）【高身長＆美脚女子】ねっとりバキューム！,モデル体型でスタイル抜群！可愛いお顔も小さいです。意外にムッチリなお尻がそそります。形の良いおっぱい。ツンっと勃起した乳首がエロいです。舐め顔が可愛すぎ！大きな瞳でじっと見つめてくれます。安定のバキュームピストン！ずっと気持ちいい絶妙なフェラ技です。可愛いひょっとこ顔で加速するピストン我慢ができずに大量口内発射！本当にスタイルの良い女の子。顔も小さいのにチンポ丸呑み！ひょっとこフェラ顔も可愛らしくてエロかったです。,フェラチオハンター,フェラチオハンター,フェチ,500,PPV,,2024年01月07日,http://duga.jp/ppv/fellatiohunter-0136/
fellatiohunter-0137,個撮）【高身長】美人OLさん【チンポ丸呑みピストン】,高身長スレンダーボディの美人OLさん。メガネも似合って完璧です。ハリのある綺麗なおっぱい。恥ずかしいリアクションに萌えます。メガネ越しからじっと見つめる破壊力！エロ過ぎです！ねっとりと余裕のチンポ丸呑みピストンフェラ！喉奥までしっかり当て込んでます。加速するピストンに我慢限界！大量口内発射！口内発射のリアクション！たまらなくエロいです。高身長な美人OLさん。おしとやかと思いきや意外とムッツリ。ネットリとチンポを丸呑みする姿はエロ過ぎでした！,フェラチオハンター,フェラチオハンター,フェチ,500,PPV,,2024年01月14日,http://duga.jp/ppv/fellatiohunter-0137/
fellatiohunter-0138,個撮）陰キャ女子の気になるフェラ技【口内発射】,"恥ずかしそうに視線をそらす陰キャ女子。脚長でくびれもあって、プリッとしたお尻に萌えます。可愛らしいチッパイと梅干しタイプの大粒乳首がエロいです。舌ピアスの感触が新鮮で刺激的！従順な表情がたまりません。見つめてチンポチロチロからのバキュームピストンフェラ相手の反応を伺いながら、余裕の丸呑みピストンフェラいやらしいベロがしっかり絡まってエロ過ぎです！絶妙なバキュームテクニックで我慢限界！大量口内発射！恥ずかしいのか視線を逸らす表情がなんともそそります。陰キャ女子ですけどチンポとのコミュニケーションは完璧でした。",フェラチオハンター,フェラチオハンター,フェチ,500,PPV,,2024年01月21日,http://duga.jp/ppv/fellatiohunter-0138/
fellatiohunter-0139,個撮）【Gカップ美巨乳】見つめるフェラ顔がエロ過ぎる,"高級なオーラが漂う美人な奥様。なかなか庶民には味わうことのできないカラダ。存分に堪能します。Gカップ巨乳！美しいバストラインです。ハリも柔らかさも申し分なし！ずっと触っていたい素晴らしいおっぱいです。ねっとり動く舌がいやらしい。綺麗でスケベな舐め顔です。ヨダレ垂らして濃厚ピストン！こちらの反応を伺いながら、フェラを楽しんでおられます。加速するピストンに我慢限界！大量口内発射！喉奥にザーメン直撃です。僕のような庶民でも味わうことができた高級女性の濃厚フェラチオ！幸せでした。大人の女性は本当にエロいです。",フェラチオハンター,フェラチオハンター,フェチ,500,PPV,,2024年01月28日,http://duga.jp/ppv/fellatiohunter-0139/
fellatiohunter-0140,個撮）Hカップ爆乳アノちゃん！【エロ大粒乳首】,サラサラ黒髪のボブが可愛い！服の上からでもわかる至福の揉みごこち大迫力のHカップ爆乳！たまりません！大粒乳首がエロ過ぎる！口の中で転がしたい大満足の重量と柔らかさ。思う存分楽しみます。ねっとり絡める舌さばきがエロいです見つめてひょっとこ顔！絶妙なバキュームピストンフェラ！濃厚な唾液とひねりを加えたピストンテクニックがスゴイです。加速するピストンに我慢限界！大量口内発射！最後はお掃除フェラまでしてくれます。とにかく大きくてエロいおっぱい！大粒乳首が本当にそそります。バキュームフェラのひょっとこ顔がとてもスケベでした。,フェラチオハンター,フェラチオハンター,フェチ,500,PPV,,2024年02月04日,http://duga.jp/ppv/fellatiohunter-0140/
fellatiohunter-0141,個撮）フェラ顔美人のねっとりピストンフェラ,可愛さが残る美人さん。張りのある肉感を味わいます。推定Cカップの超美乳！キュっと勃起した乳首がエロいです。弾ける柔らかさが素晴らしい！可愛い顔して一生懸命舐めてくれます粘りある吸引が気持ち良すぎ！美人とのギャップが凄い！バキュームフェラ顔に萌えます。相手の反応を見ながらねっとりフェラ！フェラする横顔も美人です。強めのバキュームでしごかれて、我慢できずに大量口内発射！最後はお掃除フェラまでしてくれます。可愛さ残る美人さんです！フェラも一生懸命してくれます。フェラする横顔がとても美人でエロかったです！,フェラチオハンター,フェラチオハンター,フェチ,500,PPV,,2024年02月11日,http://duga.jp/ppv/fellatiohunter-0141/
fellatiohunter-0142,個撮）【おねだり顔射15】可愛い顔してデカ舌エロ過ぎ！,可愛いお顔のムッチリボディ！おっぱいもお尻も触り心地抜群です。ピンク乳首のFカップおっぱい。思う存分楽しみます。どこにしまってあったのか？舌デカすぎです！可愛い顔で見つめてベロ舐め。舌のデカさ伝わります。絶妙なバキュームフェラから丸呑みスロート！スゴイフェラ技です舌を絡めてヨダレダラダラ。ねっとりローリングが気持ち良すぎです！可愛いお顔にザーメン発射！至福の時間です。とにかくデカ舌がエロ過ぎです！迫力のディープスロート！ねっとりローリング技も一見の価値ありです。,フェラチオハンター,フェラチオハンター,フェチ,500,PPV,,2024年02月18日,http://duga.jp/ppv/fellatiohunter-0142/
fellatiohunter-0143,個撮）チンポ丸呑み＆ノーハンド！エロ技フェラ,"ショートカットが似合うお姉さん。服の上からでもわかる巨乳に胸が高鳴ります。恥ずかしそうにGカップおっぱいを披露！柔らかいおっぱいを思う存分楽しみます。ながーい舌がエロ過ぎです！長い舌がねっとりと絡みつく。見つめる瞳もたまりません。絶妙なバキュームピストンからのチンポ丸呑み！スゴイテクニックです。ヨダレ垂らして高速ピストン＆ねっとりディープスロートザーメンをおねだりするような表情でフェラされると我慢限界！大量口内発射！見つめる大きな瞳、ショートカット美人、Gカップ巨乳、丸呑みフェラ！男が喜ぶエロアイテム満載！そして抜群のフェラテク！文句なしにおすすめです。",フェラチオハンター,フェラチオハンター,フェチ,500,PPV,,2024年02月25日,http://duga.jp/ppv/fellatiohunter-0143/
fellatiohunter-0144,個撮）フェラで感じるFカップお姉さん【チンポ丸呑み】,"清楚感漂うお姉さん。ムッチリボディと透け下着がエロいです。ハリのはるFカップおっぱいを披露！柔らかくて、とても形の良いおっぱいです。両方の乳首を同時に触って、エロさが際立ちます。絶妙なバキュームと丸呑みピストン！チンポを咥えてとてもうれしそうです。喉奥突きまくり！フェラして感じる表情がエロいです。チンポ丸呑み！大量ヨダレがチンポに絡みついて気持ち良すぎです。加速するピストンに我慢限界！ザーメン全部搾り取られてごっくん！エロ過ぎです。おしとやかそうに見えて、実はドエロなお姉さん。フェラすると表情一変！ザーメン全部搾り取る凄いフェラチオでした。",フェラチオハンター,フェラチオハンター,フェチ,500,PPV,,2024年03月03日,http://duga.jp/ppv/fellatiohunter-0144/
fellatiohunter-0145,個撮）むっつりスケベの色白お姉さん【口内発射】,"大きな瞳に吸い込まれそうな色白お姉さん。ムッチリ下半身がエロい！形の良い！キメの細かい色白おっぱいハリも柔らかさも申し分なし！笑顔が素敵でとってもエロい！可愛い顔してスケベです。じっと見つめてネットリフェラチオ！ノーハンドで絶妙なバキュームです。うら筋舐めから、亀頭を包み込んでピストン！気持ち良すぎです。加速するピストンの我慢限界！大量口内発射！口内発射リアクションも萌えます。大きな瞳が印象的なお姉さん。じっと見つめられながらのフェラチオに萌えまくりでした。",フェラチオハンター,フェラチオハンター,フェチ,500,PPV,,2024年03月10日,http://duga.jp/ppv/fellatiohunter-0145/
fellatiohunter-0146,個撮）【おねだり顔射16】ほっこりキュートな天然娘,天然キュートな女の子！意外と大胆な透け下着で大きなムッチリお尻に萌え。可愛らしいおっぱいと綺麗なピンク乳首に大興奮ハリがあるのに本当に柔らかいおっぱいです。思う存分楽しみます。チロチロと乳首を弾いて、上手な舌使いです。従順そして嬉しそうにフェラしてくれます。ノーハンドフェラだって頑張ります！加速するピストンに我慢限界！可愛いお顔に大量ザーメンぶっかけ！濃厚ザーメンがお顔にべっとり！至福の時間です。素朴でキュートな雰囲気に終始萌えまくり！そんな彼女のお顔にぶっかけできて最高に幸せでした。,フェラチオハンター,フェラチオハンター,フェチ,500,PPV,,2024年03月17日,http://duga.jp/ppv/fellatiohunter-0146/
fellatiohunter-0147,個撮）こんなに美しい人妻には出会えません3,なんて美しい奥様！エロい下着とボリューミーなお尻がたまりません。バストラインが美しいEカップおっぱい吸い付くような肌質と本当に柔らかいおっぱい。ずっと触っていたい。優しく見つめて乳首舐め。その笑顔は反則です！絶妙ねっとりなローリングフェラ！フェラ顔も美しすぎます。ひねり咥えたバキューム！気持ち良すぎです。ぽってり唇もチンポに絡みつく加速するピストンに我慢限界！そのまま大量口内発射！あぁなんて綺麗なんだ。上品で美しい！すばらしい女性です。ひねりを加えた絶妙なねっとり具合がチンポとの相性ばっちり！至福の時間でした。,フェラチオハンター,フェラチオハンター,フェチ,500,PPV,,2024年03月24日,http://duga.jp/ppv/fellatiohunter-0147/
